-- pg_tin regression test: run with scripts/pg-test.sh
CREATE EXTENSION pg_tin;
CREATE TABLE docs (id serial PRIMARY KEY, body text);
INSERT INTO docs (body) VALUES
  ('stretch denim jeans'), ('raw denim jacket'), ('stretch chinos'), (NULL),
  ('Crème brûlée recipe'), ('grub bootloader uefi'), ('grub bios legacy boot'),
  ('København harbour'), ('e-mail from GRUB'), ('');
-- Enough rows to span several heap pages and index segments.
INSERT INTO docs (body)
  SELECT 'filler ' || i || CASE WHEN i % 7 = 0 THEN ' seven' ELSE '' END
                        || CASE WHEN i % 11 = 0 THEN ' eleven' ELSE '' END
  FROM generate_series(1, 20000) i;
SET maintenance_work_mem = '1MB'; -- force several segments
CREATE INDEX docs_body_tin ON docs USING tin (body);
RESET maintenance_work_mem;
SELECT count(*) > 1 AS several_segments, sum(bytes) > 0 AS has_data
  FROM tin_segments('docs_body_tin'::regclass);
 several_segments | has_data 
------------------+----------
 t                | t
(1 row)

SELECT * FROM tin_segments('docs'::regclass);
ERROR:  tin: "docs" is not a tin index
SET enable_seqscan = off;
EXPLAIN (costs off) SELECT id FROM docs WHERE body ==> 'denim -jacket';
                      QUERY PLAN                      
------------------------------------------------------
 Bitmap Heap Scan on docs
   Recheck Cond: (body ==> 'denim -jacket'::text)
   ->  Bitmap Index Scan on docs_body_tin
         Index Cond: (body ==> 'denim -jacket'::text)
(4 rows)

SELECT id, body FROM docs WHERE body ==> 'denim -jacket' ORDER BY id;
 id |        body         
----+---------------------
  1 | stretch denim jeans
(1 row)

SELECT id FROM docs WHERE body ==> 'stretch' ORDER BY id;
 id 
----
  1
  3
(2 rows)

SELECT id FROM docs WHERE body ==> 'creme' ORDER BY id;
 id 
----
  5
(1 row)

SELECT id FROM docs WHERE body ==> 'KØBENHAVN' ORDER BY id;
 id 
----
  8
(1 row)

SELECT id FROM docs WHERE body ==> 'grub (uefi OR bios)' AND body ==> 'boot' ORDER BY id;
 id 
----
  7
(1 row)

SELECT id FROM docs WHERE body ==> 'e-mail' ORDER BY id;
 id 
----
  9
(1 row)

SELECT count(*) FROM docs WHERE body ==> 'seven';
 count 
-------
  2857
(1 row)

SELECT count(*) FROM docs WHERE body ==> 'seven eleven';
 count 
-------
   259
(1 row)

SELECT count(*) FROM docs WHERE body ==> 'seven OR eleven';
 count 
-------
  4416
(1 row)

SELECT count(*) FROM docs WHERE body ==> 'filler -seven -eleven';
 count 
-------
 15584
(1 row)

SELECT count(*) FROM docs WHERE body ==> 'nothingmatches';
 count 
-------
     0
(1 row)

-- Index and sequential scan must agree exactly.
CREATE TEMP TABLE via_index AS
  SELECT q, array_agg(id ORDER BY id) ids FROM docs,
    unnest(ARRAY['seven', 'seven eleven', 'filler -seven', '(seven OR eleven) -filler', 'grub OR denim']) q
  WHERE body ==> q GROUP BY q;
RESET enable_seqscan;
SET enable_bitmapscan = off;
SELECT q, (SELECT array_agg(id ORDER BY id) FROM docs WHERE body ==> q) = ids AS same_as_seqscan
  FROM via_index ORDER BY q;
       q       | same_as_seqscan 
---------------+-----------------
 filler -seven | t
 grub OR denim | t
 seven         | t
 seven eleven  | t
(4 rows)

RESET enable_bitmapscan;
-- Errors.
SELECT 'x' ==> '"a phrase"';
ERROR:  tin: invalid query "\"a phrase\"": phrase queries are not supported yet
SELECT 'x' ==> '-only';
ERROR:  tin: invalid query "-only": negation needs a positive term beside it
SELECT * FROM tin_stats('docs'::regclass);
ERROR:  tin: "docs" is not a tin index
-- A helper: does the index return exactly what a sequential scan returns?
CREATE FUNCTION same_as_seqscan(q text) RETURNS boolean LANGUAGE plpgsql AS $$
DECLARE via_index int[]; via_seq int[];
BEGIN
  SET LOCAL enable_seqscan = off; SET LOCAL enable_bitmapscan = on;
  SELECT coalesce(array_agg(id ORDER BY id), '{}') INTO via_index FROM docs WHERE body ==> q;
  SET LOCAL enable_seqscan = on; SET LOCAL enable_bitmapscan = off;
  SELECT coalesce(array_agg(id ORDER BY id), '{}') INTO via_seq FROM docs WHERE body ==> q;
  RETURN via_index = via_seq;
END $$;
-- Writes land in the pending list and are searchable immediately.
INSERT INTO docs (body) VALUES ('fresh denim overalls'), ('fresh linen shirt');
SELECT pending_tuples FROM tin_stats('docs_body_tin'::regclass);
 pending_tuples 
----------------
              2
(1 row)

SET enable_seqscan = off;
SELECT id, body FROM docs WHERE body ==> 'fresh' ORDER BY id;
  id   |         body         
-------+----------------------
 20011 | fresh denim overalls
 20012 | fresh linen shirt
(2 rows)

SELECT id FROM docs WHERE body ==> 'denim' ORDER BY id;
  id   
-------
     1
     2
 20011
(3 rows)

-- Updating the indexed column: old version gone, new version found.
UPDATE docs SET body = 'stretch denim shorts' WHERE id = 3;
SELECT id, body FROM docs WHERE body ==> 'stretch' ORDER BY id;
 id |         body         
----+----------------------
  1 | stretch denim jeans
  3 | stretch denim shorts
(2 rows)

SELECT id FROM docs WHERE body ==> 'chinos';
 id 
----
(0 rows)

-- Rolled-back inserts never show up.
BEGIN; INSERT INTO docs (body) VALUES ('ghost row'); ROLLBACK;
SELECT count(*) FROM docs WHERE body ==> 'ghost';
 count 
-------
     0
(1 row)

RESET enable_seqscan;
-- Flush the pending list into a new segment.
SELECT tin_flush('docs_body_tin'::regclass) AS flushed;
 flushed 
---------
       4
(1 row)

SELECT segments > 1 AS has_segments, pending_tuples FROM tin_stats('docs_body_tin'::regclass);
 has_segments | pending_tuples 
--------------+----------------
 t            |              0
(1 row)

SELECT same_as_seqscan(q) FROM unnest(ARRAY['fresh', 'denim', 'stretch -shorts', 'seven eleven']) q;
 same_as_seqscan 
-----------------
 t
 t
 t
 t
(4 rows)

-- Deletes + VACUUM clear liveness bits, then the freed line pointers get
-- reused by new rows: old queries must not see the newcomers.
CREATE TEMP TABLE seven_slots AS SELECT ctid AS slot FROM docs WHERE body ==> 'seven';
DELETE FROM docs WHERE body ==> 'seven';
VACUUM docs;
SELECT live_tuples < 20012 AS some_dead FROM tin_stats('docs_body_tin'::regclass);
 some_dead 
-----------
 t
(1 row)

INSERT INTO docs (body) SELECT 'reborn ' || i FROM generate_series(1, 3000) i;
SELECT count(*) > 100 AS reused_slots FROM docs WHERE body ==> 'reborn' AND ctid IN (SELECT slot FROM seven_slots);
 reused_slots 
--------------
 t
(1 row)

SELECT count(*) AS seven_left FROM docs WHERE body ==> 'seven';
 seven_left 
------------
          0
(1 row)

SELECT count(*) AS reborn FROM docs WHERE body ==> 'reborn';
 reborn 
--------
   3000
(1 row)

SELECT same_as_seqscan(q) FROM unnest(ARRAY['seven', 'reborn', 'filler -eleven', 'eleven OR reborn']) q;
 same_as_seqscan 
-----------------
 t
 t
 t
 t
(4 rows)

-- Many inserts with a tiny pending limit: automatic flushes.
SET tin.pending_list_limit = '64kB';
INSERT INTO docs (body) SELECT 'bulk ' || i || ' batch' FROM generate_series(1, 5000) i;
SELECT segments >= 4 AS auto_flushed, pending_bytes < 65536 + 1000 AS bounded FROM tin_stats('docs_body_tin'::regclass);
 auto_flushed | bounded 
--------------+---------
 t            | t
(1 row)

SELECT count(*) FROM docs WHERE body ==> 'bulk batch';
 count 
-------
  5000
(1 row)

SELECT same_as_seqscan(q) FROM unnest(ARRAY['bulk', 'bulk -batch', 'reborn OR bulk', 'fresh']) q;
 same_as_seqscan 
-----------------
 t
 t
 t
 t
(4 rows)

DELETE FROM docs WHERE body ==> 'bulk' AND id % 2 = 0;
VACUUM docs;
SELECT count(*) FROM docs WHERE body ==> 'bulk';
 count 
-------
  2500
(1 row)

SELECT same_as_seqscan('bulk');
 same_as_seqscan 
-----------------
 t
(1 row)

RESET tin.pending_list_limit;
-- Identifier patterns on an index with grams: prefix, fragment, typo.
CREATE TABLE ids (id serial PRIMARY KEY, txt text);
INSERT INTO ids (txt)
  SELECT 'MSKU' || lpad((i * 7919 % 10000000)::text, 7, '0') || ' ' || lpad((i * 104729 % 1000000000)::text, 9, '0')
  FROM generate_series(1, 20000) i;
CREATE INDEX ids_tin ON ids USING tin (txt) WITH (grams = true);
CREATE FUNCTION ids_same_as_seqscan(q text) RETURNS boolean LANGUAGE plpgsql AS $$
DECLARE a int[]; b int[];
BEGIN
  SET LOCAL enable_seqscan = off; SET LOCAL enable_bitmapscan = on;
  SELECT coalesce(array_agg(id ORDER BY id), '{}') INTO a FROM ids WHERE txt ==> q;
  SET LOCAL enable_seqscan = on; SET LOCAL enable_bitmapscan = off;
  SELECT coalesce(array_agg(id ORDER BY id), '{}') INTO b FROM ids WHERE txt ==> q;
  RETURN a = b;
END $$;
SET enable_seqscan = off;
SELECT txt FROM ids WHERE txt ==> 'msku0007919' ORDER BY id;
          txt          
-----------------------
 MSKU0007919 000104729
(1 row)

SELECT count(*) FROM ids WHERE txt ==> 'msku00079*';
 count 
-------
     2
(1 row)

SELECT txt FROM ids WHERE txt ==> 'msku0007991~' ORDER BY id;  -- swapped 1 and 9
          txt          
-----------------------
 MSKU0007919 000104729
(1 row)

SELECT count(*) FROM ids WHERE txt ==> '*07919*';
 count 
-------
     6
(1 row)

RESET enable_seqscan;
SELECT q, ids_same_as_seqscan(q) FROM unnest(ARRAY[
  'msku00*', '*79190*', '*4729*', 'msku0007919~', 'msku0007991~2', 'msku00* -*9*',
  '(msku001* OR *4729*) msku*', '*0007*', 'msku1*', '*791*', 'msku00* -*791*', '*791* -*7919*']) q;
             q              | ids_same_as_seqscan 
----------------------------+---------------------
 msku00*                    | t
 *79190*                    | t
 *4729*                     | t
 msku0007919~               | t
 msku0007991~2              | t
 msku00* -*9*               | t
 (msku001* OR *4729*) msku* | t
 *0007*                     | t
 msku1*                     | t
 *791*                      | t
 msku00* -*791*             | t
 *791* -*7919*              | t
(12 rows)

-- Row estimates come from the index (exact for terms), so the search-box
-- shape `==> q LIMIT k` uses the index when q is selective.
CREATE FUNCTION est_rows(q text) RETURNS int LANGUAGE plpgsql AS $$
DECLARE j json;
BEGIN
  EXECUTE format('EXPLAIN (FORMAT JSON) SELECT * FROM ids WHERE txt ==> %L', q) INTO j;
  RETURN (j->0->'Plan'->>'Plan Rows')::int;
END $$;
SELECT q, est_rows(q) AS estimate, (SELECT count(*) FROM ids WHERE txt ==> q) AS actual
  FROM unnest(ARRAY['msku0007919', 'nosuchterm', 'msku00079*', 'msku0007991~', '*07919*',
                    'msku0007919 OR 000104729', 'msku00* -*9*']) q;
            q             | estimate | actual 
--------------------------+----------+--------
 msku0007919              |        1 |      1
 nosuchterm               |        1 |      0
 msku00079*               |        2 |      2
 msku0007991~             |        1 |      1
 *07919*                  |        1 |      6
 msku0007919 OR 000104729 |        2 |      1
 msku00* -*9*             |      190 |     44
(7 rows)

EXPLAIN (costs off) SELECT id FROM ids WHERE txt ==> 'msku0007919* -msku0007919' LIMIT 9;
                              QUERY PLAN                               
-----------------------------------------------------------------------
 Limit
   ->  Bitmap Heap Scan on ids
         Recheck Cond: (txt ==> 'msku0007919* -msku0007919'::text)
         ->  Bitmap Index Scan on ids_tin
               Index Cond: (txt ==> 'msku0007919* -msku0007919'::text)
(5 rows)

EXPLAIN (costs off) SELECT id FROM ids WHERE txt ==> '*07919*' LIMIT 10;
                     QUERY PLAN                      
-----------------------------------------------------
 Limit
   ->  Bitmap Heap Scan on ids
         Recheck Cond: (txt ==> '*07919*'::text)
         ->  Bitmap Index Scan on ids_tin
               Index Cond: (txt ==> '*07919*'::text)
(5 rows)

-- New rows go to the pending list; patterns must see them too.
INSERT INTO ids (txt) VALUES ('MSKU7777777 999999999'), ('MRKU7777770 888888888');
SELECT q, ids_same_as_seqscan(q) FROM unnest(ARRAY['*777777*', 'msku7777777~', 'mrku*', '*99999*']) q;
      q       | ids_same_as_seqscan 
--------------+---------------------
 *777777*     | t
 msku7777777~ | t
 mrku*        | t
 *99999*      | t
(4 rows)

SELECT tin_flush('ids_tin'::regclass) AS flushed;
 flushed 
---------
       2
(1 row)

SELECT q, ids_same_as_seqscan(q) FROM unnest(ARRAY['*777777*', 'msku7777777~', 'mrku*', '*99999*']) q;
      q       | ids_same_as_seqscan 
--------------+---------------------
 *777777*     | t
 msku7777777~ | t
 mrku*        | t
 *99999*      | t
(4 rows)

SELECT 'x' ==> 'e-mail*';
ERROR:  tin: invalid query "e-mail*": pattern "e-mail*" must be one term: word*, *fragment*, or word~ / word~2
-- REINDEX compacts everything into fresh segments; cached copies must not be reused.
REINDEX INDEX docs_body_tin;
SELECT pending_tuples FROM tin_stats('docs_body_tin'::regclass);
 pending_tuples 
----------------
              0
(1 row)

SELECT same_as_seqscan(q) FROM unnest(ARRAY['bulk', 'reborn', 'fresh', 'denim']) q;
 same_as_seqscan 
-----------------
 t
 t
 t
 t
(4 rows)

TRUNCATE docs;
SET enable_seqscan = off;
SELECT count(*) FROM docs WHERE body ==> 'denim';
 count 
-------
     0
(1 row)

